{
  "sourceIntakeHandoffId": "sourceintakehandoff-004",
  "generatedAt": "2026-06-06T18:10:00Z",
  "case": "contains_secret",
  "domainSetupId": "domainsetup-001",
  "domain": "weather-logistics",
  "sourceManifestBuildId": "sourcemanifestbuild-002",
  "handoffStatus": "blocked_by_builder_rejection",
  "nextAction": "replace_rejected_sources",
  "canEnterSourceIntake": false,
  "forecastGenerationAllowed": false,
  "sourceManifestId": null,
  "fieldMappingId": null,
  "sourceIntakeReportId": null,
  "sourceIntakeStatus": null,
  "mappingSummary": {
    "totalMappings": 0,
    "proposedMappingCount": 0,
    "confirmedMappingCount": 0,
    "agentInferredMappingCount": 0,
    "requiresConfirmation": false
  },
  "builderRejectionSummary": {
    "rejectedInputCount": 1,
    "reasonCodes": [
      "source_contains_secrets"
    ]
  },
  "draftArtifacts": {
    "sourceManifestBuildPath": "spec/fixtures/generated/source-handoff/weather-logistics-contains-secret-source-manifest-build.generated.json",
    "sourceManifestPath": null,
    "fieldMappingPath": null,
    "sourceIntakeReportPath": null
  },
  "requiredActions": [
    "Replace rejected builder inputs before source intake: source_contains_secrets."
  ],
  "warnings": [
    "Source-builder handoffs do not create forecast artifacts.",
    "Setup method gates are still required after accepted source intake."
  ]
}
